{"version":1,"assessment":{"id":"TEST-AR-005","key":"test:repository:example/spec"},"target":{"repository":"example/spec","reviewed_revision":"bbbbbbbb"},"mode":"security","status":"completed","findings":[],"disposition":{"outcome":"findings-raised"},"evidence":[{"id":"EV-X","class":"referenced","description":"External trace","uri":"https://example.invalid/evidence/v1","sha256":"aaaaaaaaaaaaaaaaaaaaaaaaaaaaaaaaaaaaaaaaaaaaaaaaaaaaaaaaaaaaaaaa","collected_at":"2026-08-16T00:00:00Z","sensitivity":"internal"}]}
